{
  "contract": "member-customer-360",
  "version": "1.1.0",
  "surface": "C_PUBLIC_TWINGPT",
  "principal": {
    "blog_id": 1258,
    "actor_user_id": 42
  },
  "subject": {
    "user_id": 42,
    "display_name": "Nguyễn Hương",
    "team_role": "agent"
  },
  "as_of": "2026-09-18T09:25:00+07:00",
  "coverage": {
    "complete": true,
    "degraded_sources": [],
    "truncated": false
  },
  "data": {
    "contact": {
      "contact_id": 9001,
      "conversation_id": 88,
      "display_name": "Chị Lan",
      "roles": [
        "customer"
      ]
    },
    "journey": {
      "stage": "repeat",
      "paid_order_count": 2,
      "last_touch_at": "2026-09-16 10:05:00",
      "previously_cared": true,
      "milestones": [
        {
          "kind": "last_activity",
          "at": "2026-09-16 10:05:00",
          "ref": null,
          "status": null,
          "evidence_state": "confirmed"
        },
        {
          "kind": "order",
          "at": "2026-09-01T11:00:00+07:00",
          "ref": 7001,
          "status": "completed",
          "evidence_state": "confirmed"
        },
        {
          "kind": "order",
          "at": "2026-06-11T09:00:00+07:00",
          "ref": 6120,
          "status": "completed",
          "evidence_state": "confirmed"
        },
        {
          "kind": "conversation_started",
          "at": "2026-05-02 14:00:00",
          "ref": null,
          "status": null,
          "evidence_state": "confirmed"
        },
        {
          "kind": "profile",
          "at": "2026-05-02 14:00:00",
          "ref": null,
          "status": null,
          "evidence_state": "confirmed"
        }
      ]
    },
    "tasks": [
      {
        "task_id": 501,
        "title": "Tái chạm khách nguội",
        "instructions": "Nhắn ưu đãi tháng 9",
        "priority": "high",
        "status": "sent",
        "overdue": false,
        "due_at": "2026-09-20",
        "assigned_by": {
          "display_name": "Trưởng nhóm Marketing"
        },
        "seen": false,
        "can": [
          "accept",
          "start",
          "return"
        ]
      }
    ],
    "orders": [
      {
        "order_id": 7001,
        "status": "completed",
        "total": 1890000,
        "currency": "VND",
        "created_at": "2026-09-01T11:00:00+07:00"
      }
    ]
  }
}
